<?xml version="1.0" encoding="UTF-8" ?>
<!ELEMENT education (program+)>
<!ELEMENT program (University, Degree, Year)>
<!ELEMENT University (#PCDATA)>
<!ELEMENT Degree (#PCDATA)>
<!ELEMENT Year (#PCDATA)>